[
  {
    "id": "ESP-1944-1PTA-01",
    "tipo": "moneda",
    "identificacion": {
      "pais": "España",
      "epoca": "Estado Español",
      "valor_facial": "1 Peseta",
      "ano_visible": 1944,
      "ano_estrellas": [
        19,
        44
      ],
      "ceca": "Madrid"
    },
    "tecnica": {
      "material": "Bronce-Aluminio",
      "peso_g": 3.5,
      "diametro_mm": 21.0
    },
    "coleccionismo": {
      "estado": "MBC+",
      "referencia_catalogo": "KM#766"
    },
    "adquisicion": {
      "origen": "Mercadillo Fuente de las Batallas",
      "fecha_compra": "2026-09-24",
      "precio_eur": 3.0,
      "gastos_envio_eur": 0.0
    },
    "multimedia": {
      "img_anverso": "./assets/img/ESP-1944-1PTA-01-anv.webp",
      "img_reverso": "./assets/img/ESP-1944-1PTA-01-rev.webp"
    },
    "notas": "Pátina oscura uniforme. Ligero desgaste en el busto."
  },
  {
    "id": "6767",
    "tipo": "moneda",
    "identificacion": {
      "pais": "Desconocido",
      "epoca": "Sin especificar",
      "valor_facial": "67",
      "ano_visible": 67,
      "ceca": "Sin especificar"
    },
    "tecnica": {
      "material": "Desconocido",
      "peso_g": 0,
      "diametro_mm": 0
    },
    "coleccionismo": {
      "estado": "MBC"
    },
    "adquisicion": {
      "origen": "Panel Web",
      "fecha_compra": "2026-09-25",
      "precio_eur": 67,
      "gastos_envio_eur": 0
    },
    "multimedia": {
      "img_anverso": "./assets/img/Captura de pantalla 2026-03-13 162738.webp",
      "img_reverso": ""
    },
    "notas": "Añadida mediante el sistema web v2.0."
  }
]